Regiao;Texto
Norte;"A Região Norte é maior região do Brasil em extensão territorial e envolve sete estados brasileiros: Acre, Amapá, Amazonas, Pará, Rondônia, Roraima e Tocantins.  

A região possui uma demografia baixa, com cerca de 15.864.454 habitantes, respondendo por apenas 8% do povo brasileiro. Essas pessoas estão distribuídas em uma área territorial de 3.853.575,6 km², correspondendo à menor densidade demográfica do país, com 4,12 habitantes/km².  

Os aspectos geográficos da Região Norte são bastante diversificados, com a presença de vários elementos naturais distintos. O clima predominante é o equatorial, o qual apresenta bastante umidade, temperaturas elevadas ao longo do ano (média de 25º ºC) e elevado índice pluviométrico, ou seja, chuva o ano todo. Algumas áreas apresentam clima tropical, como o Tocantins, Pará e Roraima, com duas estações bem definidas: inverno e verão. O inverno apresenta temperaturas amenas, sendo frio e seco; já o verão é quente e úmido.  

A Floresta Amazônica brasileira, conhecida como Amazônia Legal, é a principal vegetação do Norte, pois está presente em quase todo o território nortista e é responsável pelas características climáticas, hidrográficas e vegetais dessa região. Trata-se de uma floresta densa, alta, heterogênea (variedade de espécies), latifoliada (folhas largas) e perenifólias (não caem o ano todo).  

A Amazônia possui quatro tipos de variações da vegetação: mata de inundação, mata de várzea, mata de igapó e mata de terra firme. Há também na Região Norte a presença de Cerrado no Tocantins e sul do Pará.  

Além disso, a região apresenta três unidades de relevo: planaltos, planícies e depressões. Prevalecem áreas de planície na região central e nas proximidades do leito do Rio Amazonas e seus principais afluentes, a Planície do Amazonas. No norte do Amazonas, Roraima e Amapá, há incidência maior de áreas de planaltos, como o Planalto das Guianas. No sul do Pará, Tocantins e Rondônia, prevalece o Planalto Central. Destacam-se as depressões da Amazônia Ocidental (oeste do Amazonas) e Sul-Amazônica (sul do Pará).  

Sobre a hidrografia da região, sabemos que a principal bacia é a do Amazonas, que é a maior bacia hidrográfica do mundo. Ela está presente em todos os estados, exceto no leste do Pará e Tocantins, que são banhados pela Bacia do Rio Tocantins-Araguaia.  

Fonte:[mundoeducacao.uol.com.br/geografia/regiao-norte](https://mundoeducacao.uol.com.br/geografia/regiao-norte.htm), acesso em 15/02/2021.
"
Nordeste;"A região Nordeste do Brasil tem, em sua composição territorial, nove estados brasileiros e área de 1.558.000 km², correspondente a 18% do território do Brasil. Sua população já é de quase 60 milhões de habitantes.  

A Bahia é o maior estado da região, e Sergipe, o menor. A Bahia conta com a maior costa litorânea brasileira, de 932 km de praias, e o Piauí com o menor litoral, de apenas 60 km. O Nordeste inteiro conta com 3338 km de praias em todo seu litoral, que vai do sul da Bahia ao extremo noroeste do estado do Maranhão. Todos os estados do Nordeste são banhados pelo oceano Atlântico e possuem suas capitais no litoral, com exceção de Teresina, que se encontra no centro do Piauí.  

O Nordeste possui quatro sub-regiões, criadas com base em critérios naturais: Zona da Mata; Agreste; Sertão e Meio-Norte.  

No cenário natural, deve-se destacar que, na hidrografia, o rio São Francisco é o principal da região e tem maior bacia hidrográfica também. Tem-se desenvolvido um projeto de transposição do rio São Francisco, que ajudará a irrigar e levar água às regiões mais secas do Nordeste. O clima prevalecente é o semiárido, caracterizando a região com menor índice de chuva do país e temperaturas elevadas e secas prolongadas no ano.  

A vegetação prevalecente é a da Caatinga, ou Mata Branca, com a presença de poucas árvores e muitos arbustos e vegetação rasteira, com rica biodiversidade de fauna e flora. O relevo possui duas importantes unidades, com a presença de planícies costeiras, próximas das praias nordestinas, e de planaltos que circundam o sertão, com destaque para o planalto da Borborema, formando, no interior da região, a planície sertaneja, caracterizada por temperatura elevada e pela seca.  

Fonte:[mundoeducacao.uol.com.br/geografia/regiao-nordeste](https://mundoeducacao.uol.com.br/geografia/regiao-nordeste.htm), acesso em 15/02/2021.
"
Centro Oeste;"A Região Centro-Oeste, entre as cinco existentes, é a segunda maior do país. É constituída por três estados e o Distrito Federal, são eles: Goiás (capital Goiânia), Mato Grosso (Cuiabá), Mato Grosso do Sul (Campo Grande) e Brasília (capital federal).
O Centro-Oeste ocupa uma área 1 606 372 km².  

A Região abriga cerca de 14.058.094 habitantes (cerca de 18,9% do território nacional) e uma densidade demográfica de 8,7 hab./km². A população do Centro-Oeste possui origem multicultural, em virtude de a mesma ser composta por pessoas vindas de diversas partes do Brasil.  

A Região Centro-Oeste é muito rica em diversidades naturais, nela são encontradas importantes características vegetais, sendo as principais: o Cerrado, o Pantanal e a floresta Amazônica. Domínios que se destacam por serem considerados patrimônios naturais do Brasil.  

Fonte:[mundoeducacao.uol.com.br/geografia/regiao-centro-oeste](https://mundoeducacao.uol.com.br/geografia/regiao-centrooeste.htm), acesso em 15/02/2021.
"
Sudeste;"A região Sudeste é conhecida por sua força econômica e suas grandes cidades. Nela estão localizadas São Paulo, Rio de Janeiro e Belo Horizonte, algumas das principais cidades brasileiras e importantíssimas para a economia nacional.  

ato marcante no Sudeste é sua população. A região é a mais populosa do Brasil, com mais de 90% da população morando em áreas urbanas, sendo também a mais urbanizada. Além disso, seus índices econômicos são altos, assim como a taxa de industrialização. Em um passado não muito distante, no século XX, foi o território que mais atraiu migrantes em busca de melhores condições de vida e oportunidades de trabalho.  

O clima no Sudeste é basicamente tropical devido a sua localização geográfica. É uma região situada entre os trópicos, tendo temperaturas elevadas na maior parte dos estados. Entretanto, alguns fatores modificam seu clima, como a altitude, a maritimidade (influência das massas de ar vindas do oceano) e a latitude.  

O relevo (altitude) exerce grande influência na distribuição de chuvas e nas diferenças de temperaturas. Na cidade do Rio de Janeiro e em Santos, há maiores índices pluviométricos do que em Belo Horizonte, por exemplo. Isso porque as primeiras são litorâneas, recebendo muita umidade do oceano (maritimidade). Já a capital mineira está em uma área elevada de 852 m acima do nível do mar, com bairros que atingem mais de 1500 m de altitude.  

Das cinco regiões brasileiras, o Sudeste é a que mais apresenta diferença nas paisagens naturais se compararmos com a vegetação nativa. A alta industrialização e urbanização tiveram contribuição nisso, tendo destruído grandes áreas de matas para a construção de cidades, ferrovias e parques industriais. Atualmente existem poucos resquícios de áreas verdes na região.  

No Sudeste podemos encontrar, basicamente, quatro tipos de vegetação: Caatinga, Cerrado, floresta tropical (Mata Atlântica) e vegetação litorânea (Manguezais).  

A Caatinga é comum no norte de Minas Gerais devido ao clima semiárido. É uma paisagem parecida com a da região Nordeste, principalmente na região do vale do Jequitinhonha.  

Já o Cerrado, vegetação bem comum em climas tropicais, é encontrado em São Paulo e em grande parte de Minas Gerais. É uma vegetação com galhos tortuosos, de baixo e médio porte, mas com raízes profundas, capazes de buscar água no subsolo na época de estiagem.  

A Mata Atlântica possui uma grande biodiversidade e pode ser encontrada nos quatro estados. Devido a essa biodiversidade, foi muito desmatada para fins comerciais e urbanísticos, restando pouca vegetação original.  

No litoral há Manguezais e Restingas, vegetações típicas dessa área. No Sudeste, entretanto, a especulação imobiliária afeta essa vegetação, o que atrapalha o ecossistema e a vida presente nesses biomas.  

Fonte:[brasilescola.uol.com.br/brasil/regiao-sudeste](https://brasilescola.uol.com.br/brasil/regiao-sudeste.htm), acesso em 15/02/2021.
"
Sul;"A região Sul é a menor das cinco regiões em que se divide o território brasileiro. É composta apenas por três estados: Paraná, Santa Catarina e Rio Grande do Sul. Ainda assim, é a segunda maior densidade demográfica do Brasil, ficando atrás apenas da região Sudeste. Por estar localizada inteiramente abaixo do Trópico de Capricórnio, o clima predominante é o Subtropical. A região é coberta pela Mata de Araucárias e pelos Pampas, e o seu relevo é composto, em sua maioria, por planaltos.  

A região Sul é composta por três estados: Paraná, Santa Catarina e Rio Grande do Sul. Com área territorial de, aproximadamente, 577 mil km2, sua superfície corresponde a 6,77% da área total do país, de acordo com dados do IBGE para 2019.  

Por influência das elevadas latitudes e da altitude, as características morfoclimáticas da região Sul são bastante distintas das outras regiões do Brasil. A primeira diz respeito ao tipo climático, predominantemente o Subtropical.  

Uma das principais características desse clima é a distinção clara entre as quatro estações do ano, o que se dá pela variação anual da temperatura. Embora as médias sejam baixas com relação ao restante do país, pode haver variação térmica considerável durante os meses mais quentes do ano, quando os termômetros podem marcar de 30 ºC a 39 ºC em algumas áreas. Os ventos e o relevo também interferem na temperatura da região e no regime pluviométrico.  

O Sul está sob influência da Massa Polar Atlântica (mPa), responsável pela queda brusca das temperaturas durante o inverno. Nesse período, pode haver a ocorrência de neve em alguns municípios, como Bom Jardim da Serra, São Joaquim, Urupema e Uruci, em Santa Catarina.  

A região encontra-se na área de cobertura de dois biomas:  

* Mata Atlântica, que cobre parte do Paraná e de Santa Catarina e a porção norte do Rio Grande do Sul;  

* Pampas, que, no Brasil, são exclusivos do Rio Grande do Sul.  

A formação mais conhecida da região é a Mata de Araucárias. Esse domínio estende-se pelo Paraná e por parte do território catarinense e do Rio Grande do Sul. As araucárias recebem também o nome de pinheiro-do-paraná ou pinheiro-brasileiro. O domínio encontra-se bastante devastado, com apenas 3% de sua cobertura original, devido à ação da indústria madeireira e à expansão do agronegócio.  

No Rio Grande do Sul, por onde se estende os Pampas, a cobertura vegetal é de baixo porte, com a predominância de gramíneas. A Campanha Gaúcha, no sudoeste do estado, constitui a sua principal paisagem, além de ser uma das maiores regiões produtoras de vinho do Brasil.  

A maior parte da região Sul está sobre a área de abrangência da bacia sedimentar do Paraná. Sua paisagem é composta por planaltos e áreas de depressões, as quais se estendem em uma faixa limitada no leste do Paraná e de Santa Catarina e na região central do Rio Grande do Sul. Neste, no extremo sul e sudoeste, há ocorrência de planícies.  

Fonte:[mundoeducacao.uol.com.br/geografia/regiao-sul](https://mundoeducacao.uol.com.br/geografia/sul-menor-regiao-brasileira.htm), acesso em 15/02/2021.
"
